{
  "input_fingerprint": "0123456789abcdef0123456789abcdef0123456789abcdef0123456789abcdef",
  "skill_version": "0.4.3.0",
  "collapse_positive": true,
  "coverage_complete": true,
  "divergence_state": "neutral",
  "curl_state": "null",
  "diagnostic_completeness": true,
  "live_registers_covered": ["xi", "Omega"],
  "max_generation_depth": 0,
  "loopbreak_count": 0,
  "loopbreak_grounds": [],
  "verified_activations": ["B1", "B2"],
  "hold_partial_nodes": [],
  "primary_track_closed": true,
  "restoration_track_closed": true,
  "divergence_positive_addressed": true,
  "curl_resolved": true,
  "terminal_stop_proof_complete": true,
  "terminal_stop_proof_count": 1,
  "restoration_endpoint_reached": true,
  "checker_version": "check_graph_completeness.py:b1-schema-light",
  "timestamp": "2026-05-30T00:00:00Z"
}
