{
  "checker_version": "check_graph_completeness.py:b1-schema-light",
  "collapse_positive": true,
  "coverage_complete": true,
  "curl_resolved": true,
  "curl_state": "null",
  "diagnostic_completeness": true,
  "divergence_positive_addressed": true,
  "divergence_state": "neutral",
  "hold_partial_nodes": [],
  "input_fingerprint": "9a74ac0e32084b913aab21d532246287b8b304435a3552c02df90a0011342463",
  "live_registers_covered": [
    "xi",
    "kappa"
  ],
  "loopbreak_count": 0,
  "loopbreak_grounds": [],
  "max_generation_depth": 0,
  "primary_track_closed": true,
  "restoration_endpoint_reached": true,
  "restoration_track_closed": true,
  "skill_version": "0.4.3.0",
  "terminal_stop_proof_complete": true,
  "terminal_stop_proof_count": 1,
  "timestamp": "2026-05-30T00:00:00Z",
  "verified_activations": [
    "B1"
  ]
}
